{
  "id": "ocr.structured",
  "description": "文档 OCR：快档出文本行，慢档出版面结构（Markdown + 元素标签）。",
  "tiers": [
    {
      "tier": "gpu-fast",
      "engine": "pp-ocrv6",
      "engine_version": "paddleocr-3.7",
      "cost": "low",
      "latency_hint": "~0.5s/page",
      "vram_mb": 2048,
      "max_concurrency": 2
    },
    {
      "tier": "gpu",
      "engine": "paddleocr-vl",
      "engine_version": "1.6-0.9b",
      "cost": "high",
      "latency_hint": "~9s/page",
      "vram_mb": 12288,
      "max_concurrency": 1
    }
  ],
  "input": { "fields": [
    { "name": "media", "kind": "media", "required": true,
      "accepts": ["image/*", "application/pdf"], "cardinality": { "min": 1, "max": 1 } },
    { "name": "options", "kind": "json", "required": false, "schema": {
      "type": "object",
      "properties": {
        "pages": {
          "type": "array",
          "items": {
            "type": "integer",
            "minimum": 1
          }
        }
      }
    } }
  ] },
  "purpose": "ocr",
  "output": { "fields": [
    { "name": "document", "kind": "json", "required": true, "schema": {
      "type": "object",
      "properties": {
        "pages": {
          "type": "array"
        }
      },
      "required": [
        "pages"
      ]
    } }
  ], "agent_context": "none" },
  "visibility": "public"
}
