{
  "id": "pitch_transcribe",
  "description": "对哼唱 / 歌唱段做音高转写，输出音符列表。",
  "consumes": {
    "labels": [
      "Humming",
      "Singing",
      "Music"
    ],
    "granularity": "segment"
  },
  "tiers": [
    {
      "tier": "gpu",
      "engine": "basic-pitch",
      "engine_version": "0.4.0",
      "cost": "medium",
      "latency_hint": "~2s",
      "vram_mb": 1024
    }
  ],
  "input": { "fields": [
    { "name": "media", "kind": "media", "required": true,
      "accepts": ["*/*"], "cardinality": { "min": 1, "max": 1 } },
    { "name": "selection", "kind": "json", "required": true, "schema": {
      "type": "object",
      "properties": {
        "start": {
          "type": "number"
        },
        "end": {
          "type": "number"
        }
      },
      "required": [
        "start",
        "end"
      ]
    } }
  ] },
  "purpose": "diagnostic",
  "output": { "fields": [
    { "name": "notes", "kind": "json", "required": true, "schema": {
      "type": "object",
      "properties": {
        "notes": {
          "type": "array"
        }
      }
    } }
  ], "agent_context": "none" },
  "visibility": "public"
}
